STATION ID	STATION NAME	CLASS	AGGECOREGION	DRAIN_SQKM	HUC02	LAT_GAGE	LONG_GAGE	STATE	ACTIVE09	FLOWYRS_1900_2009	FLOWYRS_1950_2009	FLOWYRS_1990_2009
1013500	Fish River near Fort Kent, Maine	Ref	NorthEast	2252.696	1	47.23739444	-68.58264167	ME	yes	85	60	20
1022500	Narraguagus River at Cherryfield, Maine	Ref	NorthEast	573.6006	1	44.60797222	-67.93524167	ME	yes	61	60	20
1030500	Mattawamkeag River near Mattawamkeag, Maine	Ref	NorthEast	3676.172	1	45.500975	-68.30595556	ME	yes	75	60	20
1031500	Piscataquis River near Dover-Foxcroft, Maine	Ref	NorthEast	769.0482	1	45.17500833	-69.31469722	ME	yes	107	60	20
1047000	Carrabassett River near North Anson, Maine	Ref	NorthEast	909.0972	1	44.8692	-69.95510278	ME	yes	88	60	20
1052500	Diamond River near Wentworth Location, NH	Ref	NorthEast	383.8234	1	44.87739444	-71.05749444	NH	yes	68	60	20
1054200	Wild River at Gilead, Maine	Ref	NorthEast	180.981	1	44.39044444	-70.97964444	ME	yes	45	45	20
1055000	Swift River near Roxbury, Maine	Ref	NorthEast	250.641	1	44.64274722	-70.58878333	ME	yes	80	60	20
1057000	Little Androscoggin River near South Paris, Maine	Ref	NorthEast	190.9188	1	44.30399167	-70.53968056	ME	yes	88	60	20
1073000	OYSTER RIVER NEAR DURHAM, NH	Ref	NorthEast	31.2984	1	43.14869556	-70.96506028	NH	yes	74	60	20
1078000	SMITH RIVER NEAR BRISTOL, NH	Ref	NorthEast	222.4566	1	43.56646306	-71.7478569	NH	yes	91	60	20
1117468	BEAVER RIVER NEAR USQUEPAUG, RI	Ref	NorthEast	25.3413	1	41.49260028	-71.6281194	RI	yes	34	34	20
1118300	PENDLETON HILL BROOK NEAR CLARKS FALLS, CT.	Ref	NorthEast	10.3644	1	41.47482139	-71.8342372	CT	yes	51	51	20
1121000	MOUNT HOPE RIVER NEAR WARRENVILLE, CT.	Ref	NorthEast	70.25372	1	41.84370889	-72.1689661	CT	yes	69	60	20
1123000	LITTLE RIVER NEAR HANOVER, CT.	Ref	NorthEast	77.85271	1	41.671765	-72.052298	CT	yes	58	58	20
1134500	MOOSE RIVER AT VICTORY, VT	Ref	NorthEast	195.1299	1	44.51172311	-71.8373143	VT	yes	62	60	20
1137500	AMMONOOSUC RIVER AT BETHLEHEM JUNCTION, NH	Ref	NorthEast	228.5543	1	44.2686741	-71.63036172	NH	yes	70	60	20
1139000	WELLS RIVER AT WELLS RIVER, VT	Ref	NorthEast	246.3333	1	44.15034134	-72.06509154	VT	yes	69	60	20
1139800	EAST ORANGE BRANCH AT EAST ORANGE, VT	Ref	NorthEast	22.7997	1	44.09284191	-72.33565327	VT	yes	51	51	20
1142500	AYERS BROOK AT RANDOLPH, VT	Ref	NorthEast	82.16668	1	43.93450969	-72.65788214	VT	yes	69	59	20
1144000	WHITE RIVER AT WEST HARTFORD, VT	Ref	NorthEast	1790.244	1	43.7142361	-72.41814889	VT	yes	93	60	20
1150900	OTTAUQUECHEE RIVER NEAR WEST BRIDGEWATER, VT	Ref	NorthEast	61.1667	1	43.62229069	-72.7589899	VT	yes	25	25	20
1162500	PRIEST BROOK NEAR WINCHENDON, MA	Ref	NorthEast	49.70559	1	42.6825859	-72.1150812	MA	yes	90	60	20
1169000	NORTH RIVER AT SHATTUCKVILLE, MA	Ref	NorthEast	230.6412	1	42.63841778	-72.7250922	MA	yes	69	60	20
1170100	GREEN RIVER NEAR COLRAIN, MA	Ref	NorthEast	106.9924	1	42.70341694	-72.6706475	MA	yes	42	42	20
1181000	WEST BRANCH WESTFIELD RIVER AT HUNTINGTON, MA	Ref	NorthEast	243.495	1	42.23731167	-72.8956542	MA	yes	74	60	20
1187300	HUBBARD RIVER NR. WEST HARTLAND, CT.	Ref	NorthEast	53.919	1	42.03731639	-72.9389911	MA	yes	70	59	20
1195100	INDIAN RIVER NEAR CLINTON, CT.	Ref	NorthEast	14.8383	1	41.3059325	-72.53120139	CT	yes	27	27	20
1208990	SAUGATUCK RIVER NEAR REDDING, CT.	Ref	NorthEast	53.77249	1	41.29454	-73.39512028	CT	yes	45	45	20
1333000	GREEN RIVER AT WILLIAMSTOWN, MA	Ref	NorthEast	112.1643	2	42.70896944	-73.196773	MA	yes	60	60	20
1350000	SCHOHARIE CREEK AT PRATTSVILLE NY	Ref	NorthEast	612.5148	2	42.31952821	-74.43653726	NY	yes	102	60	20
1350080	MANOR KILL AT WEST CONESVILLE NEAR GILBOA NY	Ref	NorthEast	83.8404	2	42.3770259	-74.4129244	NY	yes	23	23	20
1350140	MINE KILL NEAR NORTH BLENHEIM NY	Ref	NorthEast	43.7598	2	42.42896817	-74.47292501	NY	yes	34	34	20
1362200	ESOPUS CREEK AT ALLABEN NY	Ref	NorthEast	169.1902	2	42.1170341	-74.38014921	NY	yes	46	46	20
1365000	RONDOUT CREEK NEAR LOWES CORNERS NY	Ref	NorthEast	99.5688	2	41.86648184	-74.48710014	NY	yes	72	60	20
1411300	TUCKAHOE RIVER AT HEAD OF RIVER NJ	Ref	SECstPlain	79.3179	2	39.30694444	-74.8205556	NJ	yes	39	39	20
1413500	EAST BR DELAWARE R AT MARGARETVILLE NY	Ref	NorthEast	424.1025	2	42.14481017	-74.65348886	NY	yes	72	60	20
1414500	MILL BROOK NEAR DUNRAVEN NY	Ref	NorthEast	64.4517	2	42.10619915	-74.7304349	NY	yes	72	60	20
1415000	TREMPER KILL NEAR ANDES NY	Ref	NorthEast	85.6287	2	42.1200874	-74.81849264	NY	yes	72	60	20
1423000	WEST BRANCH DELAWARE RIVER AT WALTON NY	Ref	NorthEast	859.6809	2	42.16619633	-75.13989107	NY	yes	59	59	20
1434025	BISCUIT BK ABOVE PIGEON BK AT FROST VALLEY NY	Ref	NorthEast	9.7002	2	41.99537004	-74.50098708	NY	yes	26	26	20
1435000	NEVERSINK RIVER NEAR CLARYVILLE NY	Ref	NorthEast	172.458	2	41.89009153	-74.58987933	NY	yes	68	58	20
1439500	Bush Kill at Shoemakers, PA	Ref	NorthEast	305.8776	2	41.08815078	-75.03767469	PA	yes	101	60	20
1440000	FLAT BROOK NEAR FLATBROOKVILLE NJ	Ref	NorthEast	167.7204	2	41.10666667	-74.9522222	NJ	yes	86	60	20
1440400	Brodhead Creek near Analomink, PA	Ref	NorthEast	175.2084	2	41.08481482	-75.21462514	PA	yes	52	52	20
1451800	Jordan Creek near Schnecksville, PA	Ref	EastHghlnds	135.8448	2	40.66176219	-75.626854	PA	yes	43	43	20
1466500	MCDONALDS BRANCH IN LEBANON STATE FOREST NJ	Ref	SECstPlain	5.376711	2	39.885	-74.50527778	NJ	yes	56	56	20
1484100	BEAVERDAM BRANCH AT HOUSTON, DE	Ref	SECstPlain	9.004751	2	38.90577778	-75.51275	DE	yes	51	51	20
1485500	NASSAWANGO CREEK NEAR SNOW HILL, MD	Ref	SECstPlain	141.5394	2	38.22891667	-75.47144444	MD	yes	59	59	20
1486000	MANOKIN BRANCH NEAR PRINCESS ANNE, MD	Ref	SECstPlain	11.1807	2	38.21388889	-75.67138889	MD	yes	55	55	20
1487000	NANTICOKE RIVER NEAR BRIDGEVILLE, DE	Ref	SECstPlain	187.4102	2	38.72833333	-75.56186111	DE	yes	66	60	20
1491000	CHOPTANK RIVER NEAR GREENSBORO, MD	Ref	SECstPlain	292.0401	2	38.99719444	-75.78580556	MD	yes	61	60	20
1510000	OTSELIC RIVER AT CINCINNATUS NY	Ref	NorthEast	382.986	2	42.54118127	-75.8996425	NY	yes	66	55	20
1516500	Corey Creek near Mainesburg, PA	Ref	NorthEast	31.4838	2	41.79090746	-77.01468773	PA	yes	55	55	20
1518862	Cowanesque River at Westfield, PA	Ref	NorthEast	233.9109	2	41.92312576	-77.53192977	PA	yes	26	26	20
1532000	Towanda Creek near Monroeton, PA	Ref	NorthEast	553.941	2	41.7070195	-76.48466538	PA	yes	95	60	20
1539000	Fishing Creek near Bloomsburg, PA	Ref	EastHghlnds	701.7795	2	41.07814118	-76.43105551	PA	yes	71	60	20
1542810	Waldy Run near Emporium, PA	Ref	NorthEast	13.6242	2	41.57895225	-78.29251214	PA	yes	45	45	20
1543000	Driftwood Br Sinnemahoning Cr at Sterling Run, PA	Ref	NorthEast	705.4974	2	41.41339593	-78.19695238	PA	yes	96	60	20
1543500	Sinnemahoning Creek at Sinnemahoning, PA	Ref	NorthEast	1778.258	2	41.31728467	-78.10305957	PA	yes	71	60	20
1544500	Kettle Creek at Cross Fork, PA	Ref	NorthEast	355.0644	2	41.4758994	-77.82582513	PA	yes	69	60	20
1545600	Young Womans Creek near Renovo, PA	Ref	NorthEast	119.9975	2	41.38951168	-77.6908191	PA	yes	44	44	20
1547700	Marsh Creek at Blanchard, PA	Ref	EastHghlnds	113.5386	2	41.05950916	-77.60582641	PA	yes	54	54	20
1548500	Pine Creek at Cedar Run, PA	Ref	NorthEast	1557.047	2	41.52173586	-77.44747983	PA	yes	91	60	20
1549500	Blockhouse Creek near English Center, PA	Ref	NorthEast	97.4853	2	41.47368336	-77.23080907	PA	yes	69	60	20
1550000	Lycoming Creek near Trout Run, PA	Ref	NorthEast	452.6757	2	41.41840957	-77.03274598	PA	yes	95	60	20
1552000	Loyalsock Creek at Loyalsockville, PA	Ref	NorthEast	1129.486	2	41.32507836	-76.91246379	PA	yes	83	59	20
1552500	Muncy Creek near Sonestown, PA	Ref	NorthEast	60.6384	2	41.35702418	-76.53467084	PA	yes	69	60	20
1557500	Bald Eagle Creek at Tyrone, PA	Ref	EastHghlnds	115.2963	2	40.68367333	-78.23362439	PA	yes	65	60	20
1564500	Aughwick Creek near Three Springs, PA	Ref	EastHghlnds	445.5612	2	40.21258144	-77.92527644	PA	yes	71	60	20
1567500	Bixler Run near Loysville, PA	Ref	EastHghlnds	38.7729	2	40.37091615	-77.40220903	PA	yes	55	55	20
1568000	Sherman Creek at Shermans Dale, PA	Ref	EastHghlnds	534.3948	2	40.32341928	-77.16887034	PA	yes	80	60	20
1580000	DEER CREEK AT ROCKS, MD	Ref	SEPlains	244.3698	2	39.62997222	-76.40330556	MD	yes	83	60	20
1583500	WESTERN RUN AT WESTERN RUN, MD	Ref	SEPlains	155.8494	2	39.51077778	-76.6765	MD	yes	65	60	20
1586610	MORGAN RUN NEAR LOUISVILLE, MD	Ref	SEPlains	72.7047	2	39.45188889	-76.95530556	MD	yes	27	27	20
1591400	CATTAIL CREEK NEAR GLENWOOD, MD	Ref	SEPlains	59.094	2	39.25597222	-77.05105556	MD	yes	31	31	20
1594950	MCMILLAN F NEAR FORT PENDLETON, MD	Ref	EastHghlnds	6.1182	02	39.27669	-79.39031	MD	yes	23	23	20
1596500	SAVAGE RIVER NEAR BARTON, MD	Ref	EastHghlnds	124.6505	2	39.57005556	-79.10194444	MD	yes	61	60	20
1605500	SOUTH BRANCH POTOMAC RIVER AT FRANKLIN, WV	Ref	EastHghlnds	463.8492	2	38.63567247	-79.33781993	WV	yes	62	53	20
1606500	SO. BRANCH POTOMAC RIVER NR PETERSBURG, WV	Ref	EastHghlnds	1684.547	2	38.99122107	-79.17587059	WV	yes	81	60	20
1613050	Tonoloway Creek near Needmore, PA	Ref	EastHghlnds	27.8982	2	39.89842119	-78.13222904	PA	yes	42	42	20
1620500	NORTH RIVER NEAR STOKESVILLE, VA	Ref	EastHghlnds	44.74026	2	38.33762566	-79.24003625	VA	yes	63	60	20
1632000	N F SHENANDOAH RIVER AT COOTES STORE, VA	Ref	EastHghlnds	543.357	2	38.63706254	-78.852803	VA	yes	84	60	20
1632900	SMITH CREEK NEAR NEW MARKET, VA	Ref	EastHghlnds	245.0484	2	38.69345016	-78.64279353	VA	yes	49	49	20
1634500	CEDAR CREEK NEAR WINCHESTER, VA	Ref	EastHghlnds	263.9817	2	39.08121763	-78.32944861	VA	yes	72	60	20
1638480	CATOCTIN CREEK AT TAYLORSTOWN, VA	Ref	SEPlains	231.9951	2	39.25454651	-77.57637775	VA	yes	38	38	20
1639500	BIG PIPE CREEK AT BRUCEVILLE, MD	Ref	SEPlains	267.1785	2	39.61236111	-77.23744444	MD	yes	62	60	20
1644000	GOOSE CREEK NEAR LEESBURG, VA	Ref	SEPlains	859.1698	2	39.01955309	-77.57749181	VA	yes	81	60	20
1658500	S F QUANTICO CREEK NEAR INDEPENDENT HILL, VA	Ref	SEPlains	19.34224	2	38.5873427	-77.4285958	VA	yes	58	58	20
1664000	RAPPAHANNOCK RIVER AT REMINGTON, VA	Ref	SEPlains	1605.101	2	38.53067996	-77.81360454	VA	yes	67	60	20
1666500	ROBINSON RIVER NEAR LOCUST DALE, VA	Ref	SEPlains	463.1463	2	38.32513047	-78.0955557	VA	yes	66	60	20
1667500	RAPIDAN RIVER NEAR CULPEPER, VA	Ref	SEPlains	1209.747	2	38.35040774	-77.97499722	VA	yes	79	60	20
1669000	PISCATAWAY CREEK NEAR TAPPAHANNOCK, VA	Ref	SEPlains	71.84071	2	37.87708193	-76.90052102	VA	yes	58	58	20
1669520	DRAGON SWAMP AT MASCOT, VA	Ref	SEPlains	277.3854	2	37.63375293	-76.69634683	VA	yes	28	28	20
2011400	JACKSON RIVER NEAR BACOVA, VA	Ref	EastHghlnds	407.7162	2	38.04234707	-79.88144394	VA	yes	35	35	20
2011460	BACK CREEK NEAR SUNRISE, VA	Ref	EastHghlnds	156.3408	2	38.24540129	-79.76866328	VA	yes	35	35	20
2013000	DUNLAP CREEK NEAR COVINGTON, VA	Ref	EastHghlnds	424.7766	2	37.80290223	-80.04700431	VA	yes	81	60	20
2014000	POTTS CREEK NEAR COVINGTON, VA	Ref	EastHghlnds	396.783	2	37.72901408	-80.04228024	VA	yes	72	51	20
2015700	BULLPASTURE RIVER AT WILLIAMSVILLE, VA	Ref	EastHghlnds	285.4062	2	38.19540308	-79.57032338	VA	yes	49	49	20
2016000	COWPASTURE RIVER NEAR CLIFTON FORGE, VA	Ref	EastHghlnds	1194.551	2	37.79179587	-79.75949166	VA	yes	84	60	20
2017500	JOHNS CREEK AT NEW CASTLE, VA	Ref	EastHghlnds	276.1497	2	37.50623973	-80.10671504	VA	yes	83	60	20
2018000	CRAIG CREEK AT PARR, VA	Ref	EastHghlnds	852.3431	2	37.66596174	-79.91143881	VA	yes	84	60	20
2027000	TYE RIVER NEAR LOVINGSTON, VA	Ref	EastHghlnds	240.7671	2	37.71541868	-78.98169097	VA	yes	71	60	20
2027500	PINEY RIVER AT PINEY RIVER, VA	Ref	EastHghlnds	123.3423	2	37.70236251	-79.02752541	VA	yes	60	60	20
2028500	ROCKFISH RIVER NEAR GREENFIELD, VA	Ref	EastHghlnds	245.4534	2	37.86958499	-78.82335431	VA	yes	66	60	20
2038850	HOLIDAY CREEK NEAR ANDERSONVILLE, VA	Ref	SEPlains	22.00359	2	37.41542434	-78.63583923	VA	yes	43	43	20
2046000	STONY CREEK NEAR DINWIDDIE, VA	Ref	SEPlains	288.5238	3	37.06709421	-77.602489	VA	yes	63	60	20
2051000	NORTH MEHERRIN RIVER NEAR LUNENBURG, VA	Ref	SEPlains	144.8227	3	36.99737383	-78.34971815	VA	yes	62	59	20
2051500	MEHERRIN RIVER NEAR LAWRENCEVILLE, VA	Ref	SEPlains	1428.706	3	36.71681395	-77.83165822	VA	yes	80	60	20
2053200	POTECASI CREEK NEAR UNION, NC	Ref	SECstPlain	583.6599	3	36.37083333	-77.02555556	NC	yes	51	51	20
2053800	S F ROANOKE RIVER NEAR SHAWSVILLE, VA	Ref	EastHghlnds	280.7226	3	37.14013231	-80.26643281	VA	yes	49	49	20
2055100	TINKER CREEK NEAR DALEVILLE, VA	Ref	EastHghlnds	30.5352	3	37.41763318	-79.93531928	VA	yes	53	53	20
2056900	BLACKWATER RIVER NEAR ROCKY MOUNT, VA	Ref	SEPlains	298.1079	3	37.0451406	-79.8441993	VA	yes	33	33	20
2059500	GOOSE CREEK NEAR HUDDLESTON, VA	Ref	SEPlains	485.4078	3	37.17319951	-79.5203076	VA	yes	79	60	20
2064000	FALLING RIVER NEAR NARUNA, VA	Ref	SEPlains	427.7682	3	37.12680956	-78.95973745	VA	yes	73	60	20
2065500	CUB CREEK AT PHENIX, VA	Ref	SEPlains	252.5787	3	37.07931121	-78.76361777	VA	yes	63	60	20
2069700	SOUTH MAYO RIVER NEAR NETTLERIDGE, VA	Ref	SEPlains	221.1336	3	36.57097103	-80.12949277	VA	yes	47	47	20
2070000	NORTH MAYO RIVER NEAR SPENCER, VA	Ref	SEPlains	270.6084	3	36.56819358	-79.98726539	VA	yes	80	60	20
2074500	SANDY RIVER NEAR DANVILLE, VA	Ref	SEPlains	288.531	3	36.61958252	-79.50419322	VA	yes	80	60	20
2077200	HYCO CREEK NEAR LEASBURG, NC	Ref	SEPlains	121.6944	3	36.39777778	-79.19666667	NC	yes	45	45	20
2081500	TAR RIVER NEAR TAR RIVER, NC	Ref	SEPlains	428.3661	3	36.19416667	-78.58305556	NC	yes	70	60	20
2082950	LITTLE FISHING CREEK NEAR WHITE OAK, NC	Ref	SEPlains	460.8531	3	36.18333333	-77.87611111	NC	yes	50	50	20
2084557	VAN SWAMP NEAR HOKE, NC	Ref	SECstPlain	56.13005	3	35.73083333	-76.74611111	NC	yes	32	32	20
2092500	TRENT RIVER NEAR TRENTON, NC	Ref	SECstPlain	447.5751	3	35.06416667	-77.46138889	NC	yes	58	58	20
2102908	FLAT CREEK NEAR INVERNESS, NC	Ref	SEPlains	19.7253	3	35.18277778	-79.1775	NC	yes	41	41	20
2108000	NORTHEAST CAPE FEAR RIVER NEAR CHINQUAPIN, NC	Ref	SEPlains	1569.485	3	34.82888889	-77.83222222	NC	yes	69	60	20
2110500	WACCAMAW RIVER NEAR LONGS, SC	Ref	SECstPlain	2908.315	3	33.9126719	-78.71501746	SC	yes	59	59	20
2111180	ELK CREEK AT ELKVILLE, NC	Ref	EastHghlnds	131.4666	3	36.07138889	-81.40305556	NC	yes	44	44	20
2111500	REDDIES RIVER AT NORTH WILKESBORO, NC	Ref	EastHghlnds	233.6607	3	36.175	-81.16888889	NC	yes	70	60	20
2112120	ROARING RIVER NEAR ROARING RIVER, NC	Ref	EastHghlnds	322.2684	3	36.25027778	-81.04444444	NC	yes	45	45	20
2112360	MITCHELL RIVER NEAR STATE ROAD, NC	Ref	SEPlains	205.2963	3	36.31138889	-80.80722222	NC	yes	45	45	20
2118500	HUNTING CREEK NEAR HARMONY, NC	Ref	SEPlains	400.527	3	36.00055556	-80.74555556	NC	yes	58	58	20
2125000	BIG BEAR CR NR RICHFIELD, NC	Ref	SEPlains	144.5499	3	35.33472222	-80.33555556	NC	yes	55	55	20
2128000	LITTLE RIVER NEAR STAR, NC	Ref	SEPlains	273.4758	3	35.38722222	-79.83138889	NC	yes	55	55	20
2137727	CATAWBA R NR PLEASANT GARDENS, NC	Ref	EastHghlnds	329.544	3	35.68583333	-82.06027778	NC	yes	29	29	20
2140991	JOHNS RIVER AT ARNEYS STORE, NC	Ref	EastHghlnds	521.9865	3	35.83361111	-81.71194444	NC	yes	24	24	20
2143000	HENRY FORK NEAR HENRY RIVER, NC	Ref	EastHghlnds	216.6723	3	35.68444444	-81.40333333	NC	yes	73	60	20
2143040	JACOB FORK AT RAMSEY, NC	Ref	EastHghlnds	66.48413	3	35.59068629	-81.56703706	NC	yes	48	48	20
2149000	COVE CREEK NEAR LAKE LURE, NC	Ref	EastHghlnds	203.8527	3	35.42345364	-82.11149778	NC	yes	58	58	20
2152100	FIRST BROAD RIVER NEAR CASAR, NC	Ref	EastHghlnds	154.9944	3	35.49305556	-81.68222222	NC	yes	50	50	20
2177000	CHATTOOGA RIVER NEAR CLAYTON, GA	Ref	EastHghlnds	526.7736	3	34.81398141	-83.30599301	GA	yes	70	60	20
2178400	TALLULAH RIVER NEAR CLAYTON, GA	Ref	EastHghlnds	151.2753	3	34.89037075	-83.53044102	GA	yes	45	45	20
2193340	KETTLE CREEK NEAR WASHINGTON, GA	Ref	SEPlains	87.8733	3	33.68262815	-82.857923	GA	yes	23	23	20
2196000	STEVENS CREEK NEAR MODOC, SC	Ref	SEPlains	1408.382	3	33.72929717	-82.18178732	SC	yes	64	54	20
2198100	BEAVERDAM CREEK NEAR SARDIS, GA	Ref	SEPlains	79.49071	3	32.93765809	-81.8153916	GA	yes	23	23	20
2202600	BLACK CREEK NEAR BLITCHTON, GA	Ref	SECstPlain	590.472	3	32.16798033	-81.48816698	GA	yes	29	29	20
2212600	FALLING CREEK NEAR JULIETTE, GA	Ref	SEPlains	187.9614	3	33.0998535	-83.72351041	GA	yes	45	45	20
2215100	TUCSAWHATCHEE CREEK NEAR HAWKINSVILLE, GA	Ref	SEPlains	420.2923	3	32.23944444	-83.50166667	GA	yes	23	23	20
2216180	TURNPIKE CREEK NEAR MCRAE, GA	Ref	SEPlains	129.111	3	31.99138889	-82.92194444	GA	yes	26	26	20
2221525	MURDER CREEK BELOW EATONTON, GA	Ref	SEPlains	490.7976	3	33.25235506	-83.48127624	GA	yes	32	32	20
2231000	ST. MARYS RIVER NR MACCLENNY, FLA.	Ref	SECstPlain	1748.368	3	30.35884726	-82.08150134	FL	yes	83	60	20
2231342	FT DRUM CREEK AT SUNSHINE ST PKY NEAR FT DRUM, FL	Ref	SECstPlain	111.5622	03	27.5686473	-80.7961709	FL	yes	32	32	20
2235200	BLACKWATER CREEK NEAR CASSIA, FL	Ref	SECstPlain	297.6956	3	28.87453056	-81.48938333	FL	yes	26	26	20
2236500	BIG CREEK NEAR CLERMONT, FL	Ref	SECstPlain	146.8755	03	28.44778229	-81.74007599	FL	yes	51	51	20
2245500	SOUTH FORK BLACK CREEK NR PENNEY FARMS, FLA.	Ref	SECstPlain	348.4345	3	29.97940752	-81.85204256	FL	yes	70	60	20
2246000	NORTH FORK BLACK CREEK NR MIDDLEBURG, FLA.	Ref	SECstPlain	451.0611	3	30.11329532	-81.9064915	FL	yes	78	60	20
2296500	CHARLIE CREEK NEAR GARDNER FL	Ref	SECstPlain	886.3965	3	27.37504297	-81.79647082	FL	yes	59	59	20
2297155	HORSE CREEK NEAR MYAKKA HEAD FL	Ref	SECstPlain	93.6036	3	27.48726132	-82.02341972	FL	yes	32	32	20
2297310	HORSE CREEK NEAR ARCADIA FL	Ref	SECstPlain	528.3765	3	27.19949477	-81.98841931	FL	yes	59	59	20
2298123	PRAIRIE CREEK NEAR FORT OGDEN FL	Ref	SECstPlain	540.6534	3	27.05199986	-81.78452667	FL	yes	37	37	20
2298608	MYAKKA RIVER AT MYAKKA CITY FL	Ref	SECstPlain	312.3423	3	27.34365621	-82.15675562	FL	yes	35	35	20
2299950	MANATEE RIVER NEAR MYAKKA HEAD FL	Ref	SECstPlain	174.2715	3	27.47365137	-82.21120106	FL	yes	43	43	20
2300700	BULLFROG CREEK NEAR WIMAUMA FL	Ref	SECstPlain	73.84104	3	27.79197208	-82.35203685	FL	yes	34	34	20
2310947	WITHLACOOCHEE RIVER NEAR CUMPRESSCO, FLA.	Ref	SECstPlain	649.5634	3	28.31195156	-82.05591468	FL	yes	42	42	20
2312200	LITTLE WITHLACOOCHEE RIVER AT RERDELL, FLA.	Ref	SECstPlain	413.4789	3	28.57277286	-82.15536307	FL	yes	51	51	20
2314500	SUWANNEE RIVER AT US 441, AT FARGO, GA	Ref	SECstPlain	3322.154	3	30.68055556	-82.56055556	GA	yes	76	60	20
2315500	SUWANNEE RIVER AT WHITE SPRINGS, FLA.	Ref	SECstPlain	6136.255	3	30.32578122	-82.73818263	FL	yes	84	60	20
2324000	STEINHATCHEE RIVER NEAR CROSS CITY, FLA.	Ref	SECstPlain	791.0239	3	29.78661294	-83.32152625	FL	yes	59	59	20
2324400	FENHOLLOWAY RIVER NEAR FOLEY, FLA.	Ref	SECstPlain	176.2654	3	30.09827057	-83.47181116	FL	yes	54	54	20
2327100	SOPCHOPPY RIVER NR SOPCHOPPY, FLA.	Ref	SECstPlain	271.1182	3	30.12936856	-84.49434823	FL	yes	45	45	20
2342933	SOUTH FORK COWIKEE CREEK NEAR BATESVILLE AL	Ref	SEPlains	290.0952	3	32.01765721	-85.29577044	AL	yes	43	43	20
2349900	TURKEY CREEK AT BYROMVILLE, GA	Ref	SEPlains	122.8673	3	32.19555556	-83.90222222	GA	yes	51	51	20
2350900	KINCHAFOONEE CREEK NEAR DAWSON, GA	Ref	SEPlains	1365.12	3	31.76444444	-84.25333333	GA	yes	24	24	20
2361000	CHOCTAWHATCHEE RIVER NEAR NEWTON, AL.	Ref	SEPlains	1781.611	3	31.34294923	-85.61049115	AL	yes	79	60	20
2363000	PEA RIVER NEAR ARITON AL	Ref	SEPlains	1292.513	3	31.59488716	-85.78299751	AL	yes	54	43	20
2369800	BLACKWATER RIVER NEAR BRADLEY AL	Ref	SEPlains	227.5129	3	31.02767985	-86.70995668	AL	yes	42	42	20
2371500	CONECUH RIVER AT BRANTLEY AL	Ref	SEPlains	1292.785	3	31.57349458	-86.25162264	AL	yes	72	60	20
2372250	PATSALIGA CREEK NEAR BRANTLEY AL	Ref	SEPlains	1145.223	3	31.59627177	-86.40551809	AL	yes	35	35	20
2374500	MURDER CREEK NEAR EVERGREEN AL	Ref	SEPlains	445.7151	3	31.41850006	-86.9866403	AL	yes	72	60	20
2381600	FAUSETT CREEK NEAR TALKING ROCK, GA	Ref	EastHghlnds	10.3248	3	34.57036618	-84.46881552	GA	yes	35	35	20
2384540	MILL CREEK NEAR CRANDALL, GA	Ref	EastHghlnds	21.3714	3	34.87202382	-84.72132621	GA	yes	24	24	20
2395120	TWO RUN CREEK NEAR KINGSTON, GA	Ref	EastHghlnds	84.0105	3	34.24277778	-84.88972222	GA	yes	29	29	20
2408540	HATCHET CREEK BELOW ROCKFORD AL	Ref	SEPlains	682.4097	3	32.91678962	-86.27025073	AL	yes	29	29	20
2415000	HILLABEE CREEK NEAR HACKNEYVILLE AL	Ref	SEPlains	491.3829	3	33.0667867	-85.87912978	AL	yes	42	42	20
2422500	MULBERRY CREEK AT JONES AL	Ref	SEPlains	527.5476	3	32.58291031	-86.90359911	AL	yes	67	56	20
2430085	RED BUD CREEK NR MOORES MILL, MS	Ref	SEPlains	40.5621	3	34.46666667	-88.28361111	MS	yes	34	34	20
2430615	MUD CREEK NR FAIRVIEW, MS	Ref	SEPlains	28.7145	3	34.3925	-88.355	MS	yes	34	34	20
2450250	SIPSEY FORK NEAR GRAYSON AL	Ref	EastHghlnds	231.8252	3	34.28537757	-87.39890838	AL	yes	43	43	20
2464000	NORTH RIVER NEAR SAMANTHA AL	Ref	EastHghlnds	578.9448	3	33.47928058	-87.5972297	AL	yes	56	46	20
2464146	TURKEY CREEK NEAR TUSCALOOSA	Ref	EastHghlnds	15.8229	3	33.41344824	-87.5105601	AL	yes	26	26	20
2464360	BINION CREEK BELOW GIN CREEK NEAR SAMANTHA AL	Ref	SEPlains	148.6152	3	33.42483704	-87.6425091	AL	yes	23	23	20
2465493	ELLIOTTS CREEK AT MOUNDVILLE AL	Ref	SEPlains	83.4174	3	32.99734636	-87.62222952	AL	yes	33	33	20
2469800	SATILPA CREEK NEAR COFFEEVILLE AL	Ref	SEPlains	422.6814	3	31.74432473	-88.02250658	AL	yes	49	49	20
2472000	LEAF RIVER NR COLLINS, MS	Ref	SEPlains	1927.134	3	31.70694444	-89.40694444	MS	yes	71	60	20
2472500	BOUIE CREEK NR HATTIESBURG, MS	Ref	SEPlains	789.9363	3	31.42583333	-89.41472222	MS	yes	71	60	20
2479155	CYPRESS CREEK NR JANICE, MS	Ref	SEPlains	137.2806	3	31.02527778	-89.01666667	MS	yes	43	43	20
2479300	RED CREEK AT VESTRY, MS	Ref	SEPlains	1144.201	3	30.73611111	-88.78111111	MS	yes	48	48	20
2479560	ESCATAWPA RIVER NEAR AGRICOLA MS	Ref	SEPlains	1454.328	3	30.80907749	-88.45862738	MS	yes	36	36	20
2481000	BILOXI RIVER AT WORTHAM, MS	Ref	SEPlains	249.2316	3	30.5586111	-89.1219444	MS	yes	57	57	20
2481510	WOLF RIVER NR LANDON, MS	Ref	SEPlains	800.6598	3	30.48361111	-89.27444444	MS	yes	38	38	20
3010655	Oswayo Creek at Shinglehouse, PA	Ref	NorthEast	254.4417	5	41.96173237	-78.19806624	PA	yes	35	35	20
3011800	Kinzua Creek near Guffey, PA	Ref	NorthEast	100.0953	5	41.76645099	-78.71863999	PA	yes	44	44	20
3015500	Brokenstraw Creek at Youngsville, PA	Ref	NorthEast	784.8513	5	41.85255871	-79.31727083	PA	yes	100	60	20
3021350	French Creek near Wattsburg, PA	Ref	NorthEast	239.6691	5	42.01533201	-79.78255074	PA	yes	35	35	20
3026500	Sevenmile Run near Rasselas, PA	Ref	NorthEast	20.3058	5	41.63117349	-78.57668985	PA	yes	57	57	20
3028000	West Branch Clarion River at Wilcox, PA	Ref	NorthEast	161.1102	5	41.57533955	-78.69224919	PA	yes	56	56	20
3049000	Buffalo Creek near Freeport, PA	Ref	EastHghlnds	357.1533	5	40.71589833	-79.6994935	PA	yes	69	60	20
3049800	Little Pine Creek near Etna, PA	Ref	EastHghlnds	14.8878	5	40.5203462	-79.93810799	PA	yes	47	47	20
3050000	TYGART VALLEY RIVER NEAR DAILEY, WV	Ref	EastHghlnds	487.287	5	38.809275	-79.8817342	WV	yes	81	47	20
3066000	BLACKWATER R AT DAVIS, WV	Ref	EastHghlnds	222.7851	5	39.12705242	-79.46838516	WV	yes	88	60	20
3069500	CHEAT RIVER NEAR PARSONS, WV	Ref	EastHghlnds	1856.853	5	39.12288353	-79.68117409	WV	yes	96	60	20
3070500	BIG SANDY CREEK AT ROCKVILLE, WV	Ref	EastHghlnds	517.3794	5	39.61563755	-79.70477427	WV	yes	96	60	20
3076600	BEAR CREEK AT FRIENDSVILLE, MD	Ref	EastHghlnds	127.3991	5	39.65613889	-79.39411111	MD	yes	45	45	20
3078000	CASSELMAN RIVER AT GRANTSVILLE, MD	Ref	EastHghlnds	161.4825	5	39.70219444	-79.13638889	MD	yes	62	60	20
3140000	Mill Creek near Coshocton OH	Ref	EastHghlnds	70.3458	5	40.36284598	-81.86235635	OH	yes	72	60	20
3144000	Wakatomika Creek near Frazeysburg OH	Ref	EastHghlnds	363.4146	5	40.13256823	-82.14792013	OH	yes	73	60	20
3159540	Shade River near Chester OH	Ref	EastHghlnds	400.851	5	39.06368935	-81.88180237	OH	yes	43	43	20
3161000	SOUTH FORK NEW RIVER NEAR JEFFERSON, NC	Ref	EastHghlnds	527.8624	5	36.39333333	-81.40694444	NC	yes	82	59	20
3164000	NEW RIVER NEAR GALAX, VA	Ref	EastHghlnds	2952.736	5	36.64734972	-80.978969	VA	yes	80	60	20
3165000	CHESTNUT CREEK AT GALAX, VA	Ref	EastHghlnds	101.9961	5	36.64596133	-80.91924444	VA	yes	65	60	20
3170000	LITTLE RIVER AT GRAYSONTOWN, VA	Ref	EastHghlnds	794.6403	5	37.03762635	-80.55672394	VA	yes	81	60	20
3173000	WALKER CREEK AT BANE, VA	Ref	EastHghlnds	773.3151	5	37.26817845	-80.70951247	VA	yes	71	60	20
3180500	GREENBRIER RIVER AT DURBIN, WV	Ref	EastHghlnds	345.0564	5	38.54372659	-79.83311495	WV	yes	66	60	20
3182500	GREENBRIER RIVER AT BUCKEYE, WV	Ref	EastHghlnds	1364.974	5	38.18595326	-80.13062254	WV	yes	80	60	20
3186500	WILLIAMS RIVER AT DYER, WV	Ref	EastHghlnds	329.6805	5	38.37899915	-80.48397372	WV	yes	80	60	20
3187500	CRANBERRY RIVER NEAR RICHWOOD, WV	Ref	EastHghlnds	207.415	5	38.29539032	-80.52647493	WV	yes	50	45	20
3213700	TUG FORK AT WILLIAMSON, WV	Ref	EastHghlnds	2425.06	5	37.67315699	-82.28014077	KY	yes	42	42	20
3237280	Upper Twin Creek at McGaw OH	Ref	EastHghlnds	32.9542	5	38.64368745	-83.21573648	OH	yes	46	46	20
3237500	Ohio Brush Creek near West Union OH	Ref	CntlPlains	1003.208	5	38.80368382	-83.42102265	OH	yes	78	60	20
3238500	White Oak Creek near Georgetown OH	Ref	CntlPlains	568.5038	5	38.85812494	-83.92853941	OH	yes	81	60	20
3241500	Massies Creek at Wilberforce OH	Ref	CntlPlains	170.9145	5	39.72283771	-83.88270656	OH	yes	57	57	20
3280700	CUTSHIN CREEK AT WOOTON, KY	Ref	EastHghlnds	158.2227	5	37.16509314	-83.30795645	KY	yes	52	52	20
3281100	GOOSE CREEK AT MANCHESTER, KY	Ref	EastHghlnds	422.7237	5	37.15203405	-83.7601974	KY	yes	45	45	20
3281500	SOUTH FORK KENTUCKY RIVER AT BOONEVILLE, KY	Ref	EastHghlnds	1838.22	5	37.47981018	-83.67519226	KY	yes	76	60	20
3285000	DIX RIVER NEAR DANVILLE, KY	Ref	SEPlains	822.3408	5	37.64202341	-84.66077678	KY	yes	67	60	20
3291780	INDIAN-KENTUCK CREEK NR CANAAN, IND.	Ref	CntlPlains	71.4105	5	38.8781136	-85.25717882	IN	yes	40	40	20
3300400	BEECH FORK AT MAUD, KY	Ref	SEPlains	1128.578	5	37.83283985	-85.29606856	KY	yes	37	37	20
3340800	BIG RACCOON CREEK NEAR FINCASTLE IND	Ref	CntlPlains	357.6537	5	39.81254461	-86.95389884	IN	yes	52	52	20
3346000	NORTH FORK EMBARRAS RIVER NEAR OBLONG, IL	Ref	SEPlains	814.6935	5	39.01004218	-87.9455882	IL	yes	69	60	20
3357350	PLUM CREEK NEAR BAINBRIDGE, IND.	Ref	CntlPlains	7.7535	5	39.76171297	-86.72945046	IN	yes	40	40	20
