50050900	RIO GRANDE DE LOIZA AT QUEBRADA ARENAS, PR	Ref	PuertoRico	15.55132	21	18.11746097	-65.9890528	PR	yes	32	32	20
50063440	QUEBRADA SONADORA NR EL VERDE, PR	Ref	PuertoRico	2.640616	21	18.32134112	-65.8171077	PR	yes	26	26	20
50063800	RIO ESPIRITU SANTO NR RIO GRANDE, PR	Ref	PuertoRico	22.4059	21	18.35828377	-65.813219	PR	yes	43	43	20
50065500	RIO MAMEYES NR SABANA, PR	Ref	PuertoRico	17.60937	21	18.32745262	-65.7507181	PR	yes	32	32	20
50092000	RIO GRANDE DE PATILLAS NR PATILLAS, PR	Ref	PuertoRico	47.58625	21	18.03246444	-66.0323866	PR	yes	22	22	20
50100450	RIO MAJADA AT LA PLENA, PR	Ref	PuertoRico	42.529	21	18.04246333	-66.20711159	PR	yes	21	21	20
50108000	RIO DESCALABRADO NR LOS LLANOS, PR	Ref	PuertoRico	33.30861	21	18.05024082	-66.4257263	PR	yes	27	27	20
50110900	RIO TOA VACA ABV LAGO TOA VACA, PR	Ref	PuertoRico	36.871	21	18.12496014	-66.45628257	PR	yes	20	20	20
50113800	RIO CERRILLOS ABV LAGO CERRILLOS NR PONCE, PR	Ref	PuertoRico	30.719	21	18.1149608	-66.6043395	PR	yes	20	20	20
208111310	CASHIE RIVER AT SR1257 NEAR WINDSOR, NC	Ref	SECstPlain	288.4779	3	36.04777778	-76.9841667	NC	yes	22	22	20
02096846	CANE CREEK NEAR ORANGE GROVE, NC	Ref	SEPlains	19.5696	03	35.987222	-79.206111	NC	yes	20	20	20
02427250	PINE BARREN CREEK NEAR SNOW HILL, AL.	Ref	SEPlains	675.2439	03	31.996258	-87.068319	AL	yes	20	20	20
03338780	NORTH FORK VERMILION RIVER NEAR BISMARCK, IL	Ref	CntlPlains	691.5555	05	40.265314	-87.642799	IL	yes	21	21	20
0344894205	NORTH FORK SWANNANOA RIVER NEAR WALKERTOWN, NC	Ref	EastHghlnds	38.6046	06	35.683333	-82.333056	NC	yes	20	20	20
03597590	WARTRACE CREEK BELOW COUNTY ROAD AT WARTRACE, TN	Ref	SEPlains	92.943	06	35.527295	-86.340271	TN	yes	20	20	20
05592575	HICKORY CREEK NEAR BROWNSTOWN, IL	Ref	SEPlains	115.2504	07	38.93699	-88.952838	IL	yes	21	21	20
06440200	SOUTH FORK BAD R NEAR COTTONWOOD,SD	Ref	WestPlains	649.1916	10U	43.968879	-101.76709	SD	yes	21	21	20
06623800	ENCAMPMENT RIVER AB HOG PARK CR, NR ENCAMPMENT, WY	Ref	WestMnts	187.6617	10L	41.0235791	-106.824766	WY	yes	45	45	20
07263295	Maumelle River at Williams Junction, AR	Ref	EastHghlnds	119.0277	11	34.876201	-92.774612	AR	yes	20	20	20
07362587	Alum Fork Saline River near Reform, AR	Ref	EastHghlnds	69.7725	08	34.797591	-92.933507	AR	yes	20	20	20
09423350	CARUTHERS C NR IVANPAH CA	Ref	WestXeric	2.2428	15	35.244989	-115.298876	CA	yes	45	45	20
10205030	SALINA CREEK NEAR EMERY, UT	Ref	WestMnts	134.5977	16	38.911914	-111.530465	UT	yes	46	46	20
